<?xml version="1.0" encoding="UTF-8"?>
<!DOCTYPE site SYSTEM "Librairie.dtd">
<site>
    <entete>
        <text>La super librairie
            <img src="jesaispas"></img>
            <strong> qui test la dtd</strong>
            <em> je suis barr√©</em> &copyright;
        </text>
    </entete>
    <livre numeroIsbn="E01">
        <titre>Les retards de yanis</titre>
            <auteur>
                <prenom>Pierre</prenom>
                <nom>Comb</nom>
            </auteur>
            <auteur>
                <prenom>test</prenom>
                <nom>ui</nom>
            </auteur>
        <description>
            Wtf les amis
        </description>
        <prix devise="dollar" tva="5.5" type="TTC">Chocapic</prix>
    </livre>

</site>